error_term,component_name,source,primary_metric,primary_value,secondary_metric,secondary_value,risk_level,source_table,manuscript_interpretation
E_reconstruction,point-cloud preprocessing and symmetry reconstruction,raw FLOW-3D molten-region CSV files,exact_duplicate_fraction,0.8116574962165629,coordinate_duplicate_fraction_after_exact_dedup,0.0172211949074752,medium,modeling_table.csv,The boundary is the envelope of the exported molten region; missing solid-domain data are a modeling limitation.
E_geometry,analytic free-boundary fit,ellipsoid and superellipsoid residuals plus geometric-distance diagnostics,normalized_superellipsoid_chamfer_distance,0.19657895723081684,raw_superellipsoid_chamfer_distance_m,0.00038374414350538373,medium,geometry_model_comparison.csv,"The selected superellipsoid improves the implicit boundary residual; the normalized Chamfer distance is scaled by melt-pool length, while the raw Chamfer distance remains a geometric-risk diagnostic."
E_volume_proxy,full-domain volume proxy,mirrored half-domain convex hull,superellipsoid_volume_relative_error,1.680431323282969,convex_hull_status_ok_fraction,1.0,medium_high,geometry_model_comparison.csv,"The volume metric is relative to a convex-hull proxy rather than an exact thermodynamic melt volume, so it is reported as a proxy limitation."
E_dynamics,reduced-order prediction,validation time steps,diagonal_mean_validation_relative_rmse,0.15252914921467245,Umax_validation_relative_rmse,0.29893681176510284,medium,dynamics_fit_summary.csv,The diagonal attractor is selected as a parsimonious baseline; the coupled model is retained as a negative control because its additional parameters are not supported robustly.
E_model_complexity,coupled model comparison,diagonal versus coupled validation,coupled_mean_validation_relative_rmse,0.15495636172923916,coupled_minus_diagonal_validation_relative_rmse,0.0024272125145667067,high_for_coupled_model,dynamics_model_comparison.csv,"Coupling is physically plausible but not statistically justified by this short sequence; complexity is a cost, not a benefit."
E_parameter_scale,dimensionless material-property scaling,reference-temperature and material-parameter perturbations,max_relative_dimensionless_span,0.3451845944309986,any_dimensionless_class_changed,0.0,low_medium,dimensionless_sensitivity_summary.csv,Dimensionless numbers are scaling diagnostics; sensitivity is reported to avoid over-interpreting a single reference state.
